Document,Category,Text
rules_of_engagement,Mission-Specific ROE Constraints,"b. Declared Hostile Force (DHF). Any civilian, paramilitary or military force or terrorist(s) that has
been declared hostile by appropriate U.S. authority. Once a force is declared “hostile,” U.S. units may engage that
force without observing a hostile act or demonstration of hostile intent; i.e., the basis for engagement shifts from
conduct to status. Once a force or individual is identified as a DHF, the force or individual may be engaged, unless
surrendering or hors de combat due to sickness or wounds. The authority to declare a force hostile is limited, and
may be found at Appendix A to Enclosure A, paragraph 3, of the SROE."
rules_of_engagement,Mission-Specific ROE Constraints,"(4) Mission Accomplishment v. Self-Defense. The SROE distinguish between the right and
obligation of self-defense, and the use of force for the accomplishment of an assigned mission. Authority to use
force in mission accomplishment may be limited in light of political, military, or legal concerns, but such limitations
have NO impact on a commander’s right and obligation of self-defense. Further, although commanders may limit
individual self-defense,4 commanders always retain the inherent right and obligation to exercise unit self-defense.
However, JAs must be aware that the line between action for mission accomplishment and action in self-defense is
not always clear. Distinctions between mission accomplishment and self-defense, and between offensive and
defensive operations, may vary based on the level of command, array of forces, and circumstances on the ground."
rules_of_engagement,Mission-Specific ROE Constraints,"(3) Collective Self-Defense. Defense of designated non-U.S. military forces and/or designated
foreign nationals and their property from a hostile act or demonstrated hostile intent. Only the President or SECDEF
may authorize collective self-defense. Collective self-defense is generally implemented during combined
operations."
rules_of_engagement,Mission-Specific ROE Constraints,"(2) National Self-Defense. Defense of the United States, U.S. forces, and, in certain
circumstances, U.S. persons and their property and/or U.S. commercial assets from a hostile act or demonstration of
hostile intent."
rules_of_engagement,Mission-Specific ROE Constraints,"(1) Inherent Right of Self-Defense. Unit commanders always retain the inherent right and
obligation to exercise unit self-defense in response to a hostile act or demonstrated hostile intent. Unless otherwise
directed by a unit commander as detailed below, military members may exercise individual self-defense in response
to a hostile act or demonstrated hostile intent. When individuals are assigned and acting as part of a unit, individual
self-defense should be considered a subset of unit self-defense. As such, unit commanders may limit individual selfdefense
by members of their unit. Both unit and individual self-defense include defense of other U.S. military forces
in the vicinity."
rules_of_engagement,Mission-Specific ROE Constraints,"The current SROE went into effect on 13 June 2005, the result of a review and revision of the
previous 2000 and 1994 editions"
rules_of_engagement,Mission-Specific ROE Constraints,"B. Purposes of ROE. As a practical matter, ROE serve three purposes: (1) provide guidance from the
President and Secretary of Defense (SECDEF), as well as subordinate commanders, to deployed units on the use of
force; (2) act as a control mechanism for the transition from peacetime to combat operations (war); and (3) provide a
mechanism to facilitate planning. ROE provide a framework that encompasses national policy goals, mission
requirements, and the law."
rules_of_engagement,Mission-Specific ROE Constraints,"Outside U.S. territory, the SROE apply to all military operations and contingencies. Within
U.S. territory, the SROE apply to air and maritime homeland defense missions. Included in the SROE are the
Standing Rules for the Use of Force (SRUF), which apply to civil support missions as well as land-based homeland
defense missions within U.S. territory and DoD personnel performing law enforcement functions at all DoD
installations."
rules_of_engagement,Mission-Specific ROE Constraints,"Principles of Self-Defense. All necessary means available and all appropriate actions may be used in self-defense. The
following guidelines apply:
(1) De-escalation. When time and circumstances permit, the forces committing hostile acts or demonstrating hostile
intent should be warned and given the opportunity to withdraw or cease threatening actions.
(2) Necessity. Exists when a hostile act occurs or when a force demonstrates hostile intent. When such conditions
exist, use of force in self-defense is authorized while the force continues to commit hostile acts or exhibit hostile intent.
(3) Proportionality. The use of force in self-defense should be sufficient to respond decisively to hostile acts or
demonstrations of hostile intent. Such use of force may exceed the means and intensity of the hostile act or hostile intent, but the
nature, duration and scope of force used should not exceed what is required. The concept of proportionality in self-defense
should not be confused with attempts to minimize collateral damage during offensive operations.
"
rules_of_engagement,Mission-Specific ROE Constraints,"Operational Purposes. ROE provide parameters within which the commander must operate to
accomplish his or her assigned mission:
a. ROE provide a limit on operations and ensure that U.S. actions do not trigger undesired escalation,
i.e., forcing a potential opponent into a “self-defense” response.
b. ROE may regulate a commander’s capability to influence a military action by granting or
withholding the authority to use particular weapons systems or tactics.
c. ROE may also reemphasize the scope of a mission. Units deployed overseas for training exercises
may be limited to use force only in self-defense, reinforcing the training rather than combat nature of the mission."
law_of_war_2023,Civilian Harm and Noncombatant Rights,"The law of war
has created a framework of classes of persons to help confine the fighting between opposing
military forces and thereby to help protect the civilian population from the effects of war.1"
law_of_war_2023,Civilian Harm and Noncombatant Rights,"This Chapter addresses issues relating to various classes of people under the law of war
including: (1) who is included in the various classes, such as “combatant” and “civilian”; (2) the
rights, duties, and liabilities of the persons in each class; and (3) how certain factual categories of
persons, such as journalists, police officers, or child soldiers, fall within various classes and are treated under the law of war."
law_of_war_2023,Civilian Harm and Noncombatant Rights,"Certain categories of
personnel have humanitarian duties that involve them in hostilities but also entitle them to
special protections:
• military medical and religious personnel;19
• authorized staff of voluntary aid societies;20
• staff of a recognized aid society of a neutral country;21
• auxiliary medical personnel;22 and
• personnel engaged in the protection of cultural property.23"
law_of_war_2023,Civilian Harm and Noncombatant Rights,"Certain categories of
persons are not members of the armed forces, but are nonetheless authorized to support the
armed forces in the fighting:
• persons authorized to accompany the armed forces, but who are not members thereof;24
and
• members of the crews of merchant marine vessels or civil aircraft of a belligerent.25"
law_of_war_2023,Civilian Harm and Noncombatant Rights,"Unprivileged Belligerents. Unprivileged belligerents generally are subject to the liabilities of both combatant and civilian status, and include: persons engaging in spying, sabotage, and similar acts behind enemy lines
 and private persons engaging in hostilities."
law_of_war_2023,Civilian Harm and Noncombatant Rights,"“Combatant” and “Belligerent”. “Combatant” and “belligerent” have
sometimes been used interchangeably and, in this usage, they generally describe individuals who
are not “civilians.”"
law_of_war_2023,Civilian Harm and Noncombatant Rights,"4.8.2 Civilians – Conduct of Hostilities. Civilians may not be made the object of attack,
unless they take direct part in hostilities.196 The wounded and sick, as well as the infirm, and
expectant mothers, shall be the object of particular protection and respect.197 Civilians may be
killed incidentally in military operations; however, the expected incidental harm to civilians may
not be excessive in relation to the anticipated military advantage from an attack,198 and feasible
precautions must be taken to reduce the risk of harm to civilians during military operations.199
Civilians who engage in hostilities thereby forfeit the corresponding protections of
civilian status and may be liable to treatment in one or more respects as unprivileged
belligerents.200"
law_of_war_2023,Civilian Harm and Noncombatant Rights,"4.8.3 Civilians – Detention. In general, civilians may be subject to non-violent measures
that are justified by military necessity, such as searches, or temporary detention.201 Belligerents
or Occupying Powers may take necessary security measures in relation to civilians, including
internment or assigned residence for imperative reasons of security.202
Enemy civilians who are interned during international armed conflict or occupation
generally are classified as “protected persons” under the GC and receive a variety of
protections.203 Chapter X addresses in detail the required treatment of enemy civilian internees
during international armed conflict and occupation. In all circumstances, detained civilians must
be treated humanely.204 Special categories of civilians, such as children, may require additional
consideration during detention.205"
law_of_war_2023,Civilian Harm and Noncombatant Rights,"4.24 JOURNALISTS
In general, journalists are civilians and are protected as such under the law of war.
Journalists play a vital role in free societies and the rule of law and in providing
information about armed conflict.471 Moreover, the proactive release of accurate information to
domestic and international audiences has been viewed as consistent with the objectives of U.S.
military operations.472 DoD operates under the policy that open and independent reporting is the
principal means of coverage of U.S. military operations.473 In addition to responding to press
inquiries and providing briefings to members of the press on U.S. military operations, DoD
practice has also been to embed journalists with units during military operations.474 Embedded
journalists are assigned to a unit, and they eat, sleep, and move with the unit.475"
law_of_war_2023,Civilian Harm and Noncombatant Rights,"Children Under Fifteen Who Are Orphaned or Separated. The parties to
the conflict shall take the necessary measures to ensure that children under fifteen, who are
orphaned or are separated from their families as a result of the war, are not left to their own
resources, and that their maintenance, the exercise of their religion, and their education are
facilitated in all circumstances.424 The maintenance of the children concerned means their
feeding, clothing, and accommodation, care for their health, and, where necessary, medical and
hospital treatment.425"
rules_of_engagement,Positive Identification and Hostile Intent,"b. Declared Hostile Force (DHF). Any civilian, paramilitary or military force or terrorist(s) that has
been declared hostile by appropriate U.S. authority. Once a force is declared “hostile,” U.S. units may engage that
force without observing a hostile act or demonstration of hostile intent; i.e., the basis for engagement shifts from
conduct to status. Once a force or individual is identified as a DHF, the force or individual may be engaged, unless
surrendering or hors de combat due to sickness or wounds. The authority to declare a force hostile is limited, and
may be found at Appendix A to Enclosure A, paragraph 3, of the SROE."
rules_of_engagement,Positive Identification and Hostile Intent,"c. Hostile Act. An attack or other use of force against the United States, U.S. forces, or other
designated persons or property. It also includes force used directly to preclude or impede the mission and/or duties
of U.S. forces, including the recovery of U.S. personnel or vital U.S. government property."
rules_of_engagement,Positive Identification and Hostile Intent,"d. Hostile Intent. The threat of imminent use of force against the United States, U.S. forces, or
other designated persons or property. It also includes the threat of force to preclude or impede the mission and/or
duties of U.S. forces, including the recovery of U.S. personnel or vital U.S. government property."
law_of_war_2023,Positive Identification and Hostile Intent,"5.7.1 Armed Forces and Groups and Liability to Being Made the Object of Attack.
Membership in the armed forces or belonging to an armed group makes a person liable to being
made the object of attack regardless of whether he or she is taking a direct part in hostilities.248
This is because the organization’s hostile intent may be imputed to an individual through his or
her association with the organization. Moreover, the individual, as an agent of the group, can be
assigned a combat role at any time, even if the individual normally performs other functions for
the group.249"
law_of_war_2023,Positive Identification and Hostile Intent,"Categories of Persons Who Are Combatants for the Purpose of Assessing Their
Liability to Attack. The following categories of persons are combatants who may be made the
object of attack because they are sufficiently associated with armed forces or armed groups:
• members of the armed forces of a State;253
• members of militia and volunteer corps;254
• participants in a levée en masse;255
• persons belonging to non-State armed groups;256 and
• leaders whose responsibilities include the operational command and control of the armed
forces or of a non-State armed group."
law_of_war_2023,Positive Identification and Hostile Intent,"Civilians who take a direct part in hostilities forfeit protection from being made the object
of attack."
law_of_war_2023,Positive Identification and Hostile Intent,"Examples of Taking a Direct Part in Hostilities. The following acts are
generally considered taking a direct part in hostilities that would deprive civilians who perform
them of protection from being made the object of attack. These examples are illustrative and not
exhaustive:
• taking up or bearing arms against the opposing party, or otherwise personally trying to
kill, injure, or capture personnel or damage material belonging to the opposing party,296
• providing or relaying information of immediate use in combat operations, such as
o acting as an artillery spotter or member of a ground observer corps or otherwise
relaying information to be used to direct an airstrike, mortar attack, or ambush;299
and
o acting as a guide or lookout for combatants conducting military operations;300
• supplying weapons and ammunition, whether to conventional armed forces or non-state
armed groups, or assembling weapons (such as improvised explosive devices) in close
geographic or temporal proximity to their use,301 such as
o delivering ammunition to the front lines; or
o outfitting and preparing a suicide bomber to conduct an attack.
• preparing for combat and returning from combat;
• planning, authorizing, or implementing a combat operation against the opposing party,
even if that person does not personally use weapons or otherwise employ destructive
force in connection with the operation;298
such as
o defending military objectives against enemy attack (e.g., manning an antiaircraft
gun, acting as a bodyguard for an enemy combatant);297
o acting as a member of a weapons crew;
o engaging in an act of sabotage; or
o emplacing mines or improvised explosive devices;"
law_of_war_2023,Positive Identification and Hostile Intent,"The
following acts are generally not considered taking a direct part in hostilities that would deprive
civilians who perform them of protection from being made the object of attack. These examples
are illustrative and not exhaustive:
• mere sympathy or moral support for a party’s cause;
• general contributions made by citizens to their State’s war effort (e.g., buying war bonds
or paying taxes to the government that will ultimately be used to fund the armed forces);
• police services (e.g., police officers who maintain public order against common criminals
during armed conflict);302
• independent journalism or public advocacy (e.g., opinion journalists who write columns
supporting or criticizing a State’s war effort);303
• working in a munitions factory or other factory that is not in geographic or temporal
proximity to military operations but that is supplying weapons, materiel, and other goods
useful to the armed forces of a State;304 or
• providing medical care or impartial humanitarian assistance.305
Although performing these activities does not make a person liable to being made the object of
attack, performing these activities also does not immunize a person from attack if that person
takes a direct part in hostilities or is otherwise lawfully made the object of attack."
law_of_war_2023,Positive Identification and Hostile Intent,"5.9.3 Persons Who Have Surrendered. Persons who are not in custody but who have
surrendered are hors de combat and may not be made the object of attack.321 In order to make a
person hors de combat, the surrender must be (1) genuine; (2) clear and unconditional; and (3)
under circumstances where it is feasible for the opposing party to accept the surrender.322
5.9.3.1 Genuine. The offer to surrender must be genuine. In addition to being
legally ineffective, feigning the intent to surrender can constitute perfidy.323
5.9.3.2 Clear and Unconditional. The offer to surrender must be clear and
unconditional.
Any arms being carried should be laid down."
law_of_war_2023,Positive Identification and Hostile Intent,"5.9.5 Persons Parachuting From an Aircraft in Distress. In general, persons, such as
aircrew or embarked passengers, parachuting from an aircraft in distress are treated as though
they are hors de combat, i.e., they must not be made the object of attack.339
This protection is provided because a person descending by parachute is temporarily hors
de combat just like someone who is shipwrecked340 or unconscious.341"
law_of_war_2023,Treatment of Detainees and Prisoners,"9.2.4 Humane Treatment. Humane treatment is a fundamental principle underlying the GPW; it is always required.38 Moreover, interpretations of the GPW that provide for humane treatment should be favored over rigid interpretations of the GPW that lead to results that would be detrimental to the welfare of POWs."
law_of_war_2023,Treatment of Detainees and Prisoners,Examples of Categories of Persons Who Are Not Necessarily Excluded From POW Status. The following categories of persons are not necessarily excluded from POW status simply because they belong to one of these categories: •mercenaries;57 •persons who are alleged to have committed war crimes;58 •nationals of neutral or non-belligerent States serving in the armed forces of an enemy State;59 and •persons whose capture has not been acknowledged by the Power to which they belong.60
law_of_war_2023,Treatment of Detainees and Prisoners,"Avoidance of the Combat Zone. POW camps should be situated in an area far enough from the combat zone for POWs to be out of danger ire Precautions. All precautions must be taken in POW camps against the danger of fire.214 9.11.5 Hygiene of POW Camps. POWs may be interned only in premises affording every guarantee of hygiene and healthfulness.215 POWs interned in unhealthy areas, or where the climate is injurious for them, shall be removed as soon as possible to a more favorable climate.216"
law_of_war_2023,Treatment of Detainees and Prisoners,"Necessary Sanitary Measures. The Detaining Power shall be bound to take all sanitary measures necessary to ensure the cleanliness and healthfulness of camps and to prevent epidemics.217 For example, the Detaining Power should give POWs medical examinations upon arrival, disinfect them, and provide them with any necessary inoculations.218 In addition, quarters should be kept free from vermin, and POWs suffering from contagious diseases should be placed in quarantine as needed.219"
law_of_war_2023,Treatment of Detainees and Prisoners,"Showers, Baths, Personal Toilet, and Laundry. Also, apart from the baths and showers with which the camps shall be furnished, POWs shall be provided with sufficient water and soap for their personal toilet and for washing their personal laundry; the necessary installations, facilities, and time shall be granted them for that purpose.225 For example, the POW camp may have camp laundry facilities that the POWs may use to wash their clothes, or the POWs may have access to a laundry service outside the camp.226 Although the frequency with which baths or showers may be taken is not specified, a reasonable opportunity (e.g., considering the available resources, the POWs’ cultural practices, the activities in which they are engaged) should be afforded.227"
law_of_war_2023,Treatment of Detainees and Prisoners,"9.13.1 Food for POWs. The basic daily food rations shall be sufficient in quantity, quality, and variety to keep POWs in good health and to prevent loss of weight or the development of nutritional deficiencies.242 9.13.1.1 Accounting for the Habitual Diet. Account shall also be taken of the habitual diet of the POWs.243 For example, the POWs’ cultural and religious requirements should be considered in determining and ensuring the appropriate diet.244 The preparation of the food by the POWs themselves also helps conform the food to the POWs’ habitual diet.245 9.13.1.2 Additional Food for Certain Groups. The Detaining Power shall supply POWs who work with such additional rations as are necessary for the labor on which they are employed.246 9.13.1.3 No Collective Disciplinary Measures Affecting Food. Collective disciplinary measures affecting food are prohibited.247 The use of food as an inducement to recalcitrant POWs to restore order in a POW camp is permissible.248"
law_of_war_2023,Treatment of Detainees and Prisoners,"Camp Infirmary. Every camp shall have an adequate infirmary where POWs may have the attention they require, as well as an appropriate diet.267 Isolation wards shall, if necessary, be set aside for cases of contagious or mental disease.268"
law_of_war_2023,Treatment of Detainees and Prisoners,"Monthly Medical Inspections. Medical inspections of POWs shall be held at least once a month.272 They shall include the checking and the recording of the weight of each POW.273 Their purpose shall be, in particular, to supervise the general state of health, nutrition, and cleanliness of POWs, and to detect contagious diseases, especially tuberculosis, malaria, and venereal disease.274 For this purpose, the most efficient methods available shall be employed.275 The GPW gives as an example periodic mass miniature radiography for early detection of tuberculosis, but medical experts should be consulted for the best practices."
law_of_war_2023,Treatment of Detainees and Prisoners,"POWs shall enjoy complete latitude in the exercise of their religious duties, including attendance at the service of their faith, on condition that they comply with the disciplinary routine prescribed by the military authorities.287"
law_of_war_2023,Treatment of Detainees and Prisoners,"Chaplains. Chaplains who fall into the hands of the enemy Power and who remain or are retained with a view to assisting POWs shall be allowed to minister to them and to exercise freely their ministry among POWs of the same religion, in accordance with their religious conscience.292 They shall be allocated among the various camps and labor detachments containing POWs belonging to the same forces, speaking the same language, or practicing the same religion.293"
law_of_war_2023,Treatment of Detainees and Prisoners,"POW Camp Commander. Every POW camp shall be put under the immediate authority of a responsible commissioned officer belonging to the regular armed forces of the Detaining Power.493 For example, a non-commissioned officer, a contractor, a civilian, a member of a paramilitary force, or an enemy POW may not be the camp commander.494 The POW camp commander has disciplinary powers over POWs.495"
law_of_war_2023,Discrimination and Cultural Sensitivity,"Definition of Cultural Property. For the purpose of the 1954 Hague Cultural Property Convention and this manual, cultural property includes, irrespective of origin or ownership:618 •movable or immovable property of great importance to the cultural heritage of every people;619 •buildings intended to shelter cultural property;620 and •centers containing monuments.621"
law_of_war_2023,Discrimination and Cultural Sensitivity,"Cultural property may include, but is not limited to, the following types of property (provided the property is of great importance to the cultural heritage of every people): •monuments of architecture, art, or history, whether religious or secular;632 •archaeological sites; •groups of buildings that, as a whole, are of historical or artistic interest;633 •works of art; •manuscripts, books, and other objects of artistic, historical, or archaeological interest; •scientific collections;634 and •important collections of books or archives or of reproductions of the property defined above.635"
